<?xml version="1.0" encoding="UTF-8" standalone="yes"?>
<world_drops xmlns:xsi="http://www.w3.org/2001/XMLSchema-instance" xsi:noNamespaceSchemaLocation="world_drops.xsd">
	<!-- ENHANCMENT ITEMS -->
	<!-- Manastones -->
	<world_drop dropGroup="MANASTONE_COMMON" chance="15">
		<pattern xsi:type="and_pattern">
			<pattern xsi:type="npc_item_lvl_diff" min_dif="-9" max_dif="0"/>
			<pattern xsi:type="item_cat" category="MANASTONE"/>
			<pattern xsi:type="item_quality" quality="COMMON"/>
			<pattern xsi:type="item_level" min_level="10" max_level="60"/>
		</pattern>
	</world_drop>
	<world_drop dropGroup="MANASTONE_COMMON" chance="7">
		<pattern xsi:type="and_pattern">
			<pattern xsi:type="npc_item_lvl_diff" min_dif="-9" max_dif="10"/>
			<pattern xsi:type="item_cat" category="MANASTONE"/>
			<pattern xsi:type="item_name" val="Attack">
				<function xsi:type="contains"/>
			</pattern>
			<pattern xsi:type="item_quality" quality="COMMON"/>
			<pattern xsi:type="item_level" min_level="10" max_level="60"/>
		</pattern>
	</world_drop>
	<world_drop dropGroup="MANASTONE_RARE" chance="5">
		<pattern xsi:type="and_pattern">
			<pattern xsi:type="npc_item_lvl_diff" min_dif="-9" max_dif="0"/>
			<pattern xsi:type="item_cat" category="MANASTONE"/>
			<pattern xsi:type="item_quality" quality="RARE"/>
			<pattern xsi:type="item_level" min_level="20" max_level="60"/>
			<pattern xsi:type="not_pattern">
				<pattern xsi:type="item_ids" item_ids="167000563 167000465 167000497 167000523 167000559"/>
			</pattern>
		</pattern>
	</world_drop>
	<world_drop dropGroup="MANASTONE_RARE" chance="2">
		<pattern xsi:type="and_pattern">
			<pattern xsi:type="npc_item_lvl_diff" min_dif="-9" max_dif="10"/>
			<pattern xsi:type="item_cat" category="MANASTONE"/>
			<pattern xsi:type="item_name" val="Attack">
				<function xsi:type="contains"/>
			</pattern>
			<pattern xsi:type="item_quality" quality="RARE"/>
			<pattern xsi:type="item_level" min_level="10" max_level="60"/>
		</pattern>
	</world_drop>
	<!-- Godstones -->
	<world_drop dropGroup="GODSTONES" chance="0.005">
		<pattern xsi:type="and_pattern">
			<pattern xsi:type="npc_item_lvl_diff" min_dif="0" max_dif="10"/>
			<pattern xsi:type="item_cat" category="GODSTONE"/>
			<pattern xsi:type="item_quality" quality="LEGEND"/>
			<pattern xsi:type="item_level" min_level="40" max_level="55"/>
			<pattern xsi:type="not_pattern">
				<pattern xsi:type="item_ids" item_ids="168000037 168000040 168000038"/> <!-- 10% GS which are not dropable anymore on retail -->
			</pattern>
		</pattern>
	</world_drop>
	<world_drop dropGroup="GODSTONES" chance="0.001">
		<pattern xsi:type="and_pattern">
			<pattern xsi:type="npc_item_lvl_diff" min_dif="0" max_dif="10"/>
			<pattern xsi:type="item_cat" category="GODSTONE"/>
			<pattern xsi:type="item_quality" quality="UNIQUE"/>
			<pattern xsi:type="or_pattern">
				<pattern xsi:type="npc_rating" rating="ELITE"/>
				<pattern xsi:type="npc_rating" rating="HERO"/>
			</pattern>
			<pattern xsi:type="item_level" min_level="40" max_level="55"/>
		</pattern>
	</world_drop>
	<!-- Power Shards -->
	<world_drop dropGroup="POWER_SHARDS" min_amount="1" max_amount="5" chance="30">
		<pattern xsi:type="and_pattern">
			<pattern xsi:type="npc_item_lvl_diff" min_dif="0" max_dif="9"/>
			<pattern xsi:type="item_ids" item_ids="169000003 169000004 169000005 169000007 169000008 169000009"/>
		</pattern>
	</world_drop>
	<!-- Stigma Shards -->
	
	<!-- SKILLS -->
	<!-- Stigma -->
	<world_drop dropGroup="STIGMA" chance="1">
		<pattern xsi:type="and_pattern">
			<pattern xsi:type="npc_item_lvl_diff" min_dif="-1" max_dif="1"/>
			<pattern xsi:type="item_cat" category="STIGMA"/>
			<pattern xsi:type="item_quality" quality="RARE"/>
			<pattern xsi:type="item_level" min_level="20" max_level="60"/>
			<pattern xsi:type="not_pattern">
				<pattern xsi:type="item_ids" item_ids="140000095"/>
			</pattern>
		</pattern>
	</world_drop>
	<!-- Skill Books -->
	<!-- 42 -->
	<world_drop dropGroup="SKILL_BOOKS" chance="5">
		<pattern xsi:type="and_pattern">
			<pattern xsi:type="npc_item_lvl_diff" min_dif="0" max_dif="3"/>
			<pattern xsi:type="npc_map_id" map_ids="320110000 310050000" />
			<pattern xsi:type="item_ids" item_ids="169500698 169500699 169500095 169500096 169500596 169500597 169500499 169500432 169500258 169500338 169500157 169500257 169500156 169500433 169500500 169500337"/>
		</pattern>
	</world_drop>
	<!-- 46 -->
	<world_drop dropGroup="SKILL_BOOKS" chance="5">
		<pattern xsi:type="and_pattern">
			<pattern xsi:type="npc_item_lvl_diff" min_dif="-1" max_dif="4"/>
			<pattern xsi:type="npc_map_id" map_ids="210060000 220050000" />
			<pattern xsi:type="item_ids" item_ids="169500607 169500269 169500164 169500443 169500105 169500508 169500346 169500707"/>
		</pattern>
	</world_drop>
	<!-- 53 -->
	<world_drop dropGroup="SKILL_BOOKS" chance="5">
		<pattern xsi:type="and_pattern">
			<pattern xsi:type="npc_item_lvl_diff" min_dif="-1" max_dif="1"/>
			<pattern xsi:type="npc_map_id" map_ids="300150000 300160000" />
			<pattern xsi:type="item_ids" item_ids="169500842 169500861 169500818 169500785 169500877 169500803 169500830 169500774"/>
		</pattern>
	</world_drop>
	<!-- 54 -->
	<world_drop dropGroup="SKILL_BOOKS" chance="5">
		<pattern xsi:type="and_pattern">
			<pattern xsi:type="npc_item_lvl_diff" min_dif="-1" max_dif="4"/>
			<pattern xsi:type="npc_map_id" map_ids="210050000 220070000" />
			<pattern xsi:type="item_ids" item_ids="169500777 169500776 169500864 169500865 169500844 169500832 169500805 169500788 169500804 169500787 169500833 169500845"/>
		</pattern>
	</world_drop>
	
	<!-- CRAFT MATERIALS -->
	<!-- Flux -->
	<world_drop dropGroup="FLUX_COMMON" chance="8">
		<pattern xsi:type="and_pattern">
			<pattern xsi:type="item_level" min_level="13" max_level="60"/>
			<pattern xsi:type="npc_item_lvl_diff" min_dif="-2" max_dif="2"/>
			<pattern xsi:type="item_name" val="Flux">
				<function xsi:type="contains"/>
			</pattern>
			<pattern xsi:type="item_cat" category="FLUX"/>
			<pattern xsi:type="item_quality" quality="COMMON"/>
		</pattern>
	</world_drop>
	<world_drop dropGroup="FLUX_RARE" chance="4">
		<pattern xsi:type="and_pattern">
			<pattern xsi:type="item_level" min_level="23" max_level="60"/>
			<pattern xsi:type="npc_item_lvl_diff" min_dif="-2" max_dif="2"/>
			<pattern xsi:type="item_name" val="Flux">
				<function xsi:type="contains"/>
			</pattern>
			<pattern xsi:type="item_cat" category="FLUX"/>
			<pattern xsi:type="item_quality" quality="RARE"/>
		</pattern>
	</world_drop>
	<world_drop dropGroup="FLUX_LEGEND" chance="2">
		<pattern xsi:type="and_pattern">
			<pattern xsi:type="item_level" min_level="33" max_level="60"/>
			<pattern xsi:type="npc_item_lvl_diff" min_dif="-2" max_dif="2"/>
			<pattern xsi:type="item_name" val="Flux">
				<function xsi:type="contains"/>
			</pattern>
			<pattern xsi:type="item_cat" category="FLUX"/>
			<pattern xsi:type="item_quality" quality="LEGEND"/>
		</pattern>
	</world_drop>
	<world_drop dropGroup="FLUX_UNIQUE" chance="1">
		<pattern xsi:type="and_pattern">
			<pattern xsi:type="item_level" min_level="43" max_level="60"/>
			<pattern xsi:type="npc_item_lvl_diff" min_dif="-2" max_dif="2"/>
			<pattern xsi:type="item_name" val="Flux">
				<function xsi:type="contains"/>
			</pattern>
			<pattern xsi:type="item_cat" category="FLUX"/>
			<pattern xsi:type="item_quality" quality="UNIQUE"/>
		</pattern>
	</world_drop>
	<!-- Elemental Stones -->
	<world_drop dropGroup="ELEMENTAL_STONES" chance="25">
		<pattern xsi:type="and_pattern">
			<pattern xsi:type="npc_item_lvl_diff" min_dif="0" max_dif="9"/>
			<pattern xsi:type="item_ids" item_ids="152010314 152010315 152010316 152010317 152010319"/>
			<pattern xsi:type="or_pattern">
				<pattern xsi:type="npc_rating" rating="NORMAL"/>
				<pattern xsi:type="npc_rating" rating="ELITE"/>
				<pattern xsi:type="npc_rating" rating="HERO"/>
			</pattern>
			<pattern xsi:type="or_pattern">
				<pattern xsi:type="npc_race" race="BEAST"/>
				<pattern xsi:type="npc_race" race="MAGICALMONSTER"/>
				<pattern xsi:type="npc_race" race="ELEMENTAL"/>
				<pattern xsi:type="npc_race" race="UNDEAD"/>
				<pattern xsi:type="npc_race" race="DEMIHUMANOID"/>
				<pattern xsi:type="npc_race" race="LYCAN"/>
				<pattern xsi:type="npc_race" race="LIZARDMAN"/>
				<pattern xsi:type="npc_race" race="OUTSIDER"/>
			</pattern>
		</pattern>
	</world_drop>
	<!-- TODO : Raw -->
	
	<!-- Balic Materials -->
	<world_drop dropGroup="BALAUR_MATERIAL" chance="3">
		<pattern xsi:type="and_pattern">
			<pattern xsi:type="or_pattern">
				<pattern xsi:type="npc_race" race="DRAKAN"/>
				<pattern xsi:type="npc_race" race="DRAGON"/>
				<pattern xsi:type="npc_race" race="LIZARDMAN"/>
				<pattern xsi:type="npc_race" race="NAGA"/>
			</pattern>
			<pattern xsi:type="npc_item_lvl_diff" min_dif="-9" max_dif="0"/>
			<pattern xsi:type="item_ids" item_ids="186000032 186000033 186000097"/>
		</pattern>
	</world_drop>
	<world_drop dropGroup="BALAUR_BLOOD" chance="5">
		<pattern xsi:type="and_pattern">
			<pattern xsi:type="or_pattern">
				<pattern xsi:type="npc_race" race="DRAKAN"/>
				<pattern xsi:type="npc_race" race="DRAGON"/>
				<pattern xsi:type="npc_race" race="LIZARDMAN"/>
				<pattern xsi:type="npc_race" race="NAGA"/>
			</pattern>
			<pattern xsi:type="npc_item_lvl_diff" min_dif="-9" max_dif="10"/>
			<pattern xsi:type="item_ids" item_ids="152014019 152014014 152014009 152014004"/>
		</pattern>
	</world_drop>
	<world_drop dropGroup="BALAUR_SKIN" chance="5">
		<pattern xsi:type="and_pattern">
			<pattern xsi:type="or_pattern">
				<pattern xsi:type="npc_race" race="DRAKAN"/>
				<pattern xsi:type="npc_race" race="DRAGON"/>
				<pattern xsi:type="npc_race" race="LIZARDMAN"/>
				<pattern xsi:type="npc_race" race="NAGA"/>
			</pattern>
			<pattern xsi:type="npc_item_lvl_diff" min_dif="-9" max_dif="10"/>
			<pattern xsi:type="item_ids" item_ids="152014018 152014013 152014008 152014003"/>
		</pattern>
	</world_drop>